ciudad,municipio,lugar,categoria,descripcion
Armenia,Salento,Calle Real,Patrimonio,Corredor urbano tradicional con oferta cultural y artesanal
Armenia,Salento,Valle de Cocora,Naturaleza,Senderismo en ecosistema andino con palma de cera
Armenia,Filandia,Miradores de Filandia,Paisaje,Vistas panorámicas y arquitectura tradicional
Pereira,Santa Rosa de Cabal,Entorno termal,Bienestar,Experiencias de descanso en entorno natural
Pereira,Pereira,Centro de Pereira,Patrimonio,Recorrido urbano con historia y cultura local
Manizales,Manizales,Catedral Basílica,Arquitectura,Hito arquitectónico y cultural del centro histórico
Manizales,Manizales,Recinto del Pensamiento,Naturaleza,Espacio de interpretación ambiental y biodiversidad
